[
  {
    "strName": "MSDestroyDrillMining01",
    "strTitle": "",
    "strDesc": "[us] уничтожен(о).",
    "fDuration": 0.0,
    "strThemType": "Self",
    "LootCTsUs": null,
    "LootCTsThem": null,
    "CTTestUs": null,
    "CTTestThem": null,
    "objLootModeSwitch": "ItmToolDrillMining01ComponentsShell"
  },
  {
    "strName": "MSDamageDrillMining01",
    "strTitle": "",
    "strDesc": "[us] поврежден.",
    "fDuration": 0.0,
    "strThemType": "Self",
    "LootCTsUs": null,
    "LootCTsThem": null,
    "CTTestUs": null,
    "CTTestThem": null,
    "objLootModeSwitch": "ItmToolDrillMining01ComponentsAndSelf"
  },
  {
    "strName": "MSDestroyDrillMining02",
    "strTitle": "",
    "strDesc": "[us] уничтожен(о).",
    "fDuration": 0.0,
    "strThemType": "Self",
    "LootCTsUs": null,
    "LootCTsThem": null,
    "CTTestUs": null,
    "CTTestThem": null,
    "objLootModeSwitch": "ItmToolDrillMining02ComponentsShell"
  },
  {
    "strName": "MSDamageDrillMining02",
    "strTitle": "",
    "strDesc": "[us] поврежден.",
    "fDuration": 0.0,
    "strThemType": "Self",
    "LootCTsUs": null,
    "LootCTsThem": null,
    "CTTestUs": null,
    "CTTestThem": null,
    "objLootModeSwitch": "ItmToolDrillMining02ComponentsAndSelf"
  },
  {
    "strName": "MSWallRock011x1Dmg",
    "strTitle": "",
    "strDesc": "[us] разрушен(а).",
    "strTargetPoint": null,
    "fTargetPointRange": 0,
    "strAnim": null,
    "strBubble": null,
    "aInverse": [],
    "fDuration": 0.0,
    "strThemType": "Other",
    "strRaiseUI": null,
    "nLogging": 1,
    "LootCTsUs": null,
    "LootCTsThem": null,
    "CTTestUs": null,
    "CTTestThem": null,
    "aLootItms": [],
    "objLootModeSwitch": "ItmWallRock011x1Dmg"
  },
  {
    "strName": "MSWallRock011x1Destroy",
    "strTitle": "",
    "strDesc": "[us] уничтожен(о).",
    "strTargetPoint": null,
    "fTargetPointRange": 0,
    "strAnim": null,
    "strBubble": null,
    "aInverse": [],
    "fDuration": 0.0,
    "strThemType": "Other",
    "strRaiseUI": null,
    "nLogging": 1,
    "LootCTsUs": null,
    "LootCTsThem": null,
    "CTTestUs": null,
    "CTTestThem": null,
    "aLootItms": [],
    "objLootModeSwitch": "ItmRock01Salvage",
    "bModeSwitchCheckFit": false
  },
  {
    "strName": "MSWallRock021x1Dmg",
    "strTitle": "",
    "strDesc": "[us] разрушен(а).",
    "strTargetPoint": null,
    "fTargetPointRange": 0,
    "strAnim": null,
    "strBubble": null,
    "aInverse": [],
    "fDuration": 0.0,
    "strThemType": "Other",
    "strRaiseUI": null,
    "nLogging": 1,
    "LootCTsUs": null,
    "LootCTsThem": null,
    "CTTestUs": null,
    "CTTestThem": null,
    "aLootItms": [],
    "objLootModeSwitch": "ItmWallRock021x1Dmg"
  },
  {
    "strName": "MSWallRock021x1Destroy",
    "strTitle": "",
    "strDesc": "[us] уничтожен(о).",
    "strTargetPoint": null,
    "fTargetPointRange": 0,
    "strAnim": null,
    "strBubble": null,
    "aInverse": [],
    "fDuration": 0.0,
    "strThemType": "Other",
    "strRaiseUI": null,
    "nLogging": 1,
    "LootCTsUs": null,
    "LootCTsThem": null,
    "CTTestUs": null,
    "CTTestThem": null,
    "aLootItms": [],
    "objLootModeSwitch": "ItmRock02Salvage",
    "bModeSwitchCheckFit": false
  },
  {
    "strName": "MSWallRock031x1Dmg",
    "strTitle": "",
    "strDesc": "[us] разрушен(а).",
    "strTargetPoint": null,
    "fTargetPointRange": 0,
    "strAnim": null,
    "strBubble": null,
    "aInverse": [],
    "fDuration": 0.0,
    "strThemType": "Other",
    "strRaiseUI": null,
    "nLogging": 1,
    "LootCTsUs": null,
    "LootCTsThem": null,
    "CTTestUs": null,
    "CTTestThem": null,
    "aLootItms": [],
    "objLootModeSwitch": "ItmWallRock031x1Dmg"
  },
  {
    "strName": "MSWallRock031x1Destroy",
    "strTitle": "",
    "strDesc": "[us] уничтожен(о).",
    "strTargetPoint": null,
    "fTargetPointRange": 0,
    "strAnim": null,
    "strBubble": null,
    "aInverse": [],
    "fDuration": 0.0,
    "strThemType": "Other",
    "strRaiseUI": null,
    "nLogging": 1,
    "LootCTsUs": null,
    "LootCTsThem": null,
    "CTTestUs": null,
    "CTTestThem": null,
    "aLootItms": [],
    "objLootModeSwitch": "ItmRock03Salvage",
    "bModeSwitchCheckFit": false
  },
  {
    "strName": "MSWallRock041x1Dmg",
    "strTitle": "",
    "strDesc": "[us] разрушен(а).",
    "strTargetPoint": null,
    "fTargetPointRange": 0,
    "strAnim": null,
    "strBubble": null,
    "aInverse": [],
    "fDuration": 0.0,
    "strThemType": "Other",
    "strRaiseUI": null,
    "nLogging": 1,
    "LootCTsUs": null,
    "LootCTsThem": null,
    "CTTestUs": null,
    "CTTestThem": null,
    "aLootItms": [],
    "objLootModeSwitch": "ItmWallRock041x1Dmg"
  },
  {
    "strName": "MSWallRock041x1Destroy",
    "strTitle": "",
    "strDesc": "[us] уничтожен(о).",
    "strTargetPoint": null,
    "fTargetPointRange": 0,
    "strAnim": null,
    "strBubble": null,
    "aInverse": [],
    "fDuration": 0.0,
    "strThemType": "Other",
    "strRaiseUI": null,
    "nLogging": 1,
    "LootCTsUs": null,
    "LootCTsThem": null,
    "CTTestUs": null,
    "CTTestThem": null,
    "aLootItms": [],
    "objLootModeSwitch": "ItmRock04Salvage",
    "bModeSwitchCheckFit": false
  },
  {
    "strName": "MSWallRock051x1Dmg",
    "strTitle": "",
    "strDesc": "[us] разрушен(а).",
    "strTargetPoint": null,
    "fTargetPointRange": 0,
    "strAnim": null,
    "strBubble": null,
    "aInverse": [],
    "fDuration": 0.0,
    "strThemType": "Other",
    "strRaiseUI": null,
    "nLogging": 1,
    "LootCTsUs": null,
    "LootCTsThem": null,
    "CTTestUs": null,
    "CTTestThem": null,
    "aLootItms": [],
    "objLootModeSwitch": "ItmWallRock051x1Dmg"
  },
  {
    "strName": "MSWallRock051x1Destroy",
    "strTitle": "",
    "strDesc": "[us] уничтожен(о).",
    "strTargetPoint": null,
    "fTargetPointRange": 0,
    "strAnim": null,
    "strBubble": null,
    "aInverse": [],
    "fDuration": 0.0,
    "strThemType": "Other",
    "strRaiseUI": null,
    "nLogging": 1,
    "LootCTsUs": null,
    "LootCTsThem": null,
    "CTTestUs": null,
    "CTTestThem": null,
    "aLootItms": [],
    "objLootModeSwitch": "ItmRock05Salvage",
    "bModeSwitchCheckFit": false
  },
  {
    "strName": "MSWallRock061x1Dmg",
    "strTitle": "",
    "strDesc": "[us] разрушен(а).",
    "strTargetPoint": null,
    "fTargetPointRange": 0,
    "strAnim": null,
    "strBubble": null,
    "aInverse": [],
    "fDuration": 0.0,
    "strThemType": "Other",
    "strRaiseUI": null,
    "nLogging": 1,
    "LootCTsUs": null,
    "LootCTsThem": null,
    "CTTestUs": null,
    "CTTestThem": null,
    "aLootItms": [],
    "objLootModeSwitch": "ItmWallRock061x1Dmg"
  },
  {
    "strName": "MSWallRock061x1Destroy",
    "strTitle": "",
    "strDesc": "[us] уничтожен(о).",
    "strTargetPoint": null,
    "fTargetPointRange": 0,
    "strAnim": null,
    "strBubble": null,
    "aInverse": [],
    "fDuration": 0.0,
    "strThemType": "Other",
    "strRaiseUI": null,
    "nLogging": 1,
    "LootCTsUs": null,
    "LootCTsThem": null,
    "CTTestUs": null,
    "CTTestThem": null,
    "aLootItms": [],
    "objLootModeSwitch": "ItmRock06Salvage",
    "bModeSwitchCheckFit": false
  },
  {
    "strName": "MSWallIce011x1Dmg",
    "strTitle": "",
    "strDesc": "[us] разрушен(а).",
    "strTargetPoint": null,
    "fTargetPointRange": 0,
    "strAnim": null,
    "strBubble": null,
    "aInverse": [],
    "fDuration": 0.0,
    "strThemType": "Other",
    "strRaiseUI": null,
    "nLogging": 1,
    "LootCTsUs": null,
    "LootCTsThem": null,
    "CTTestUs": null,
    "CTTestThem": null,
    "aLootItms": [],
    "objLootModeSwitch": "ItmWallIce011x1Dmg"
  },
  {
    "strName": "MSWallIce011x1Destroy",
    "strTitle": "",
    "strDesc": "[us] уничтожен(о).",
    "strTargetPoint": null,
    "fTargetPointRange": 0,
    "strAnim": null,
    "strBubble": null,
    "aInverse": [],
    "fDuration": 0.0,
    "strThemType": "Other",
    "strRaiseUI": null,
    "nLogging": 1,
    "LootCTsUs": null,
    "LootCTsThem": null,
    "CTTestUs": null,
    "CTTestThem": null,
    "aLootItms": [],
    "objLootModeSwitch": "ItmIce01Salvage",
    "bModeSwitchCheckFit": true
  },
  {
    "strName": "MSMineralDestroy",
    "strTitle": "",
    "strDesc": "[us] уничтожен(о).",
    "fDuration": 0.0,
    "strThemType": "Self",
    "LootCTsUs": null,
    "LootCTsThem": null,
    "CTTestUs": null,
    "CTTestThem": null,
    "objLootModeSwitch": "ItmMiningTrash",
    "bModeSwitchCheckFit": true
  },
  {
    "strName": "MSIceDestroy",
    "strTitle": "",
    "strDesc": "[us] уничтожен(о).",
    "fDuration": 0.0,
    "strThemType": "Self",
    "LootCTsUs": null,
    "LootCTsThem": null,
    "CTTestUs": null,
    "CTTestThem": null,
    "objLootModeSwitch": "ItmIceTrash01",
    "bModeSwitchCheckFit": true
  },
  {
    "strName": "MSFloorRockSDamage",
    "strTitle": "",
    "strDesc": "[us] уничтожен(о).",
    "fDuration": 0.0,
    "strThemType": "Self",
    "LootCTsUs": null,
    "LootCTsThem": null,
    "CTTestUs": null,
    "CTTestThem": null,
    "objLootModeSwitch": "ItmFloorRock02Damage",
    "bModeSwitchCheckFit": true
  },
  {
    "strName": "MSFloorRockCDamage",
    "strTitle": "",
    "strDesc": "[us] уничтожен(о).",
    "fDuration": 0.0,
    "strThemType": "Self",
    "LootCTsUs": null,
    "LootCTsThem": null,
    "CTTestUs": null,
    "CTTestThem": null,
    "objLootModeSwitch": "ItmFloorRock02CDamage",
    "bModeSwitchCheckFit": true
  },
  {
    "strName": "MSFloorRockMDamage",
    "strTitle": "",
    "strDesc": "[us] уничтожен(о).",
    "fDuration": 0.0,
    "strThemType": "Self",
    "LootCTsUs": null,
    "LootCTsThem": null,
    "CTTestUs": null,
    "CTTestThem": null,
    "objLootModeSwitch": "ItmFloorRock02MDamage",
    "bModeSwitchCheckFit": true
  },
  {
    "strName": "MSExplosionDestroy",
    "strTitle": "",
    "strDesc": "[us] рассеивается.",
    "fDuration": 0.0,
    "strThemType": "Other",
    "nLogging": 1,
    "aLootItms": [],